{
    "artifact_version": "2.0",
    "run_id": "temporal-v2-20260811T085034Z-9e6b3f3c",
    "case_id": "TEMP-081",
    "generated_at": "2026-08-11T09:14:31.354147Z",
    "schema_ref": "temporal-artifact-schemas/forbidden-lookup-trace.schema.json",
    "payload_sha256": "c62d957f52250b3eb5d7d091291a84d6193901be1156a846e7b26442c3442521",
    "payload": {
        "blocked_calls": [],
        "case_id": "TEMP-081",
        "forbidden_lookup_count": 0,
        "observed_queries": [],
        "repeat": 2,
        "result": "PASS"
    }
}
