{
    "artifact_version": "2.0",
    "run_id": "temporal-v2-20260811T085034Z-9e6b3f3c",
    "case_id": "TEMP-224",
    "generated_at": "2026-08-11T09:16:22.265378Z",
    "schema_ref": "temporal-artifact-schemas/comparator-result.schema.json",
    "payload_sha256": "46496459b9b74bb787a28dd8e319b552a7ee63b2c4e1a13c8d7d73c859e2ebc3",
    "payload": {
        "differences": [],
        "metrics": {
            "component_amount": {
                "matched": 2,
                "total": 2
            },
            "component_presence": {
                "matched": 2,
                "total": 2
            },
            "component_provenance": {
                "matched": 8,
                "total": 8
            },
            "component_type": {
                "matched": 2,
                "total": 2
            },
            "facts_hash": {
                "matched": 1,
                "total": 1
            },
            "output_hash": {
                "matched": 1,
                "total": 1
            },
            "provenance": {
                "matched": 9,
                "total": 9
            },
            "ruleset_hash": {
                "matched": 1,
                "total": 1
            },
            "summary": {
                "matched": 4,
                "total": 4
            }
        },
        "status": "MATCHED"
    }
}
