{
    "artifact_version": "2.0",
    "run_id": "temporal-v2-20260813T211003Z-a7304d0d",
    "case_id": "TEMP-226",
    "generated_at": "2026-08-13T21:35:22.930094Z",
    "schema_ref": "temporal-artifact-schemas/forbidden-lookup-trace.schema.json",
    "payload_sha256": "db4b4bda40ad0228197980995ea3d4cc11efef36fc065b035e8906a3292db8ee",
    "payload": {
        "blocked_calls": [],
        "case_id": "TEMP-226",
        "forbidden_lookup_count": 0,
        "observed_queries": [],
        "repeat": 2,
        "result": "PASS"
    }
}
