{
    "artifact_version": "2.0",
    "run_id": "temporal-v2-20260802T184637Z-70ea55a6",
    "case_id": "TEMP-282",
    "generated_at": "2026-08-02T19:04:01.597955Z",
    "schema_ref": "temporal-artifact-schemas/replay-response.schema.json",
    "payload_sha256": "8c74b810a1884220b59b303bc3c71400f8a7aaaf16587711433b49130e903c4e",
    "payload": {
        "components": [
            {
                "amount": "10600.000000",
                "code": "BONUS",
                "contributor_rule_ids": [
                    "rule-version-3012"
                ],
                "contributor_rule_version_ids": [
                    3012
                ],
                "source_rule_id": "rule-version-3012",
                "source_rule_version_id": 3012,
                "type": "EARNING"
            },
            {
                "amount": "6578.000000",
                "code": "LATE_DEDUCTION",
                "contributor_rule_ids": [
                    "rule-version-3013"
                ],
                "contributor_rule_version_ids": [
                    3013
                ],
                "source_rule_id": "rule-version-3013",
                "source_rule_version_id": 3013,
                "type": "DEDUCTION"
            }
        ],
        "correlation_events": [
            {
                "event": "REQUEST_RECEIVED",
                "event_id": "4206a3f5-810a-43d2-b77a-f2f3c6ca446c",
                "execution_uuid": "d0d85802-b777-427a-a249-a5966cc054a2",
                "grule_execution_id": "2228b108-5e90-4930-886b-9098fb53dda1",
                "laravel_correlation_id": "dd2de6f9-f4b0-4369-8cbe-94e44d944bc6",
                "occurred_at": "2026-08-02T19:04:01.4882391Z",
                "replay_uuid": "3c554593-1a99-4c9b-bc58-852ab4fe3d4f",
                "request_id": "e5021b0d-5839-4e57-8b00-a74bfea11440",
                "stage": "GO_HTTP",
                "translator_trace_id": "afd9cb70-1942-4289-9179-e3ddc5a2edbc"
            },
            {
                "event": "SCHEMA_VALIDATED",
                "event_id": "b2c5beb9-e42a-4e6f-9e4a-46a82074111a",
                "execution_uuid": "d0d85802-b777-427a-a249-a5966cc054a2",
                "grule_execution_id": "2228b108-5e90-4930-886b-9098fb53dda1",
                "laravel_correlation_id": "dd2de6f9-f4b0-4369-8cbe-94e44d944bc6",
                "occurred_at": "2026-08-02T19:04:01.4882391Z",
                "replay_uuid": "3c554593-1a99-4c9b-bc58-852ab4fe3d4f",
                "request_id": "e5021b0d-5839-4e57-8b00-a74bfea11440",
                "stage": "TPR_IR_VALIDATOR",
                "translator_trace_id": "afd9cb70-1942-4289-9179-e3ddc5a2edbc"
            },
            {
                "event": "HASHES_VALIDATED",
                "event_id": "55ed290c-275c-4d3e-8ca2-3a50308df153",
                "execution_uuid": "d0d85802-b777-427a-a249-a5966cc054a2",
                "grule_execution_id": "2228b108-5e90-4930-886b-9098fb53dda1",
                "laravel_correlation_id": "dd2de6f9-f4b0-4369-8cbe-94e44d944bc6",
                "occurred_at": "2026-08-02T19:04:01.4950495Z",
                "replay_uuid": "3c554593-1a99-4c9b-bc58-852ab4fe3d4f",
                "request_id": "e5021b0d-5839-4e57-8b00-a74bfea11440",
                "stage": "TPR_IR_VALIDATOR",
                "translator_trace_id": "afd9cb70-1942-4289-9179-e3ddc5a2edbc"
            },
            {
                "event": "TRANSLATION_STARTED",
                "event_id": "14916b2b-1e66-46d0-81d4-69887e537da5",
                "execution_uuid": "d0d85802-b777-427a-a249-a5966cc054a2",
                "grule_execution_id": "2228b108-5e90-4930-886b-9098fb53dda1",
                "laravel_correlation_id": "dd2de6f9-f4b0-4369-8cbe-94e44d944bc6",
                "occurred_at": "2026-08-02T19:04:01.4950495Z",
                "replay_uuid": "3c554593-1a99-4c9b-bc58-852ab4fe3d4f",
                "request_id": "e5021b0d-5839-4e57-8b00-a74bfea11440",
                "stage": "GRL_TRANSLATOR",
                "translator_trace_id": "afd9cb70-1942-4289-9179-e3ddc5a2edbc"
            },
            {
                "event": "TRANSLATION_FINISHED",
                "event_id": "c496f80c-a3dc-48e6-8216-7404af30d564",
                "execution_uuid": "d0d85802-b777-427a-a249-a5966cc054a2",
                "grule_execution_id": "2228b108-5e90-4930-886b-9098fb53dda1",
                "laravel_correlation_id": "dd2de6f9-f4b0-4369-8cbe-94e44d944bc6",
                "occurred_at": "2026-08-02T19:04:01.4950495Z",
                "replay_uuid": "3c554593-1a99-4c9b-bc58-852ab4fe3d4f",
                "request_id": "e5021b0d-5839-4e57-8b00-a74bfea11440",
                "stage": "GRL_TRANSLATOR",
                "translator_trace_id": "afd9cb70-1942-4289-9179-e3ddc5a2edbc"
            },
            {
                "event": "EXECUTION_STARTED",
                "event_id": "95d5c593-a8e9-43aa-8309-25d8f2331067",
                "execution_uuid": "d0d85802-b777-427a-a249-a5966cc054a2",
                "grule_execution_id": "2228b108-5e90-4930-886b-9098fb53dda1",
                "laravel_correlation_id": "dd2de6f9-f4b0-4369-8cbe-94e44d944bc6",
                "occurred_at": "2026-08-02T19:04:01.4950495Z",
                "replay_uuid": "3c554593-1a99-4c9b-bc58-852ab4fe3d4f",
                "request_id": "e5021b0d-5839-4e57-8b00-a74bfea11440",
                "stage": "GRULE",
                "translator_trace_id": "afd9cb70-1942-4289-9179-e3ddc5a2edbc"
            },
            {
                "event": "EXECUTION_FINISHED",
                "event_id": "0e541936-1f85-43f5-9784-ee5dcede9c55",
                "execution_uuid": "d0d85802-b777-427a-a249-a5966cc054a2",
                "grule_execution_id": "2228b108-5e90-4930-886b-9098fb53dda1",
                "laravel_correlation_id": "dd2de6f9-f4b0-4369-8cbe-94e44d944bc6",
                "occurred_at": "2026-08-02T19:04:01.5023242Z",
                "replay_uuid": "3c554593-1a99-4c9b-bc58-852ab4fe3d4f",
                "request_id": "e5021b0d-5839-4e57-8b00-a74bfea11440",
                "stage": "GRULE",
                "translator_trace_id": "afd9cb70-1942-4289-9179-e3ddc5a2edbc"
            },
            {
                "event": "RESPONSE_GENERATED",
                "event_id": "eb81f904-e296-449c-8c7b-7640b633e2c6",
                "execution_uuid": "d0d85802-b777-427a-a249-a5966cc054a2",
                "grule_execution_id": "2228b108-5e90-4930-886b-9098fb53dda1",
                "laravel_correlation_id": "dd2de6f9-f4b0-4369-8cbe-94e44d944bc6",
                "occurred_at": "2026-08-02T19:04:01.5023242Z",
                "replay_uuid": "3c554593-1a99-4c9b-bc58-852ab4fe3d4f",
                "request_id": "e5021b0d-5839-4e57-8b00-a74bfea11440",
                "stage": "GO_HTTP",
                "translator_trace_id": "afd9cb70-1942-4289-9179-e3ddc5a2edbc"
            }
        ],
        "execution_uuid": "d0d85802-b777-427a-a249-a5966cc054a2",
        "generated_grl": "\nrule TPR_de2dc51d70d70f23_0 \"TPR-IR 1.0\" salience 100 {\nwhen\n\t(employee.Status == \"aktif\")\nthen\n\tout.Emit(\"ADD_COMPONENT\", \"BONUS\", rates.Value(\"bonus_rate\"), 100, \"rule-version-3012\", 3012, 0);\n\tRetract(\"TPR_de2dc51d70d70f23_0\");\n}\n\nrule TPR_de2dc41d70d70d70_0 \"TPR-IR 1.0\" salience 50 {\nwhen\n\t(attendance.LateMinutes > 0.0)\nthen\n\tout.Emit(\"ADD_COMPONENT\", \"LATE_DEDUCTION\", (attendance.LateMinutes * rates.Value(\"late_rate\")), 50, \"rule-version-3013\", 3013, 1);\n\tRetract(\"TPR_de2dc41d70d70d70_0\");\n}\n",
        "generated_grl_sha256": "906f3558be2ed413038b360c448a2121532cf7cb90e57dc7b31669dce5f556cf",
        "grule_execution_id": "2228b108-5e90-4930-886b-9098fb53dda1",
        "laravel_correlation_id": "dd2de6f9-f4b0-4369-8cbe-94e44d944bc6",
        "matches_original_hash": true,
        "mode": "TEMPORAL_REPLAY",
        "output_sha256": "7b2781c3b997c43816091d492ff9c9abb972a2601928abed05d9b2e8392a8ac4",
        "provenance": {
            "engine_version": "go-grule-tpr-engine-1.0",
            "execution_uuid": "d0d85802-b777-427a-a249-a5966cc054a2",
            "facts_sha256": "dd54c6e52a186c644c27acaed1ed5d8dfb96300e85f29189e5f8e2daa078e401",
            "rate_version_ids": [
                1006
            ],
            "request_id": "0e0938fb-bfdb-41d1-bd86-b876cb4a39d4",
            "rule_version_ids": [
                3012,
                3013
            ],
            "ruleset_sha256": "17ad17872cb0352619504e6cc0255af3f88e38b440e3f693e9ba74a123d94949",
            "tax_version_ids": [
                2006
            ],
            "translator_version": "laravel-go-tpr-translator-1.0"
        },
        "replay_uuid": "3c554593-1a99-4c9b-bc58-852ab4fe3d4f",
        "request_id": "e5021b0d-5839-4e57-8b00-a74bfea11440",
        "rounding_trace": [
            {
                "component_code": "BONUS",
                "operation_timestamp": "2026-08-02T19:04:01.5023242Z",
                "raw_candidate_decimal": "10600",
                "rounded_result": "10600.000000",
                "rounding_mode": "HALF_UP",
                "rounding_quantum": "0.000001",
                "scale_before_rounding": 0,
                "source_rule": "rule-version-3012"
            },
            {
                "component_code": "LATE_DEDUCTION",
                "operation_timestamp": "2026-08-02T19:04:01.5023242Z",
                "raw_candidate_decimal": "6578",
                "rounded_result": "6578.000000",
                "rounding_mode": "HALF_UP",
                "rounding_quantum": "0.000001",
                "scale_before_rounding": 0,
                "source_rule": "rule-version-3013"
            }
        ],
        "summary": {
            "basic_salary": "5406000.000000",
            "gross_salary": "5416600.000000",
            "net_salary": "5410022.000000",
            "total_deductions": "6578.000000"
        },
        "translator_trace_id": "afd9cb70-1942-4289-9179-e3ddc5a2edbc"
    }
}
