{
    "artifact_version": "2.0",
    "run_id": "temporal-v2-20260811T085034Z-9e6b3f3c",
    "case_id": "TEMP-259",
    "generated_at": "2026-08-11T09:16:42.488619Z",
    "schema_ref": "temporal-artifact-schemas/version-applicability.schema.json",
    "payload_sha256": "05c14e513bd5cd24fb15aa734d23b6c424ef33875167c20c5dce620e27d971be",
    "payload": {
        "rate_version": {
            "applicability_status": "APPLICABLE_MATCHED",
            "comparison_result": true,
            "expected_ids": [
                1007
            ],
            "identity_type": "rate_version",
            "reason": "Versioned dependency was frozen in the execution manifest and resolved from the replay snapshot.",
            "resolved_ids": [
                1007
            ],
            "source": "locked_manifest_and_replay_provenance"
        },
        "rule_version": {
            "applicability_status": "APPLICABLE_MATCHED",
            "comparison_result": true,
            "expected_ids": [
                3014,
                3015
            ],
            "identity_type": "rule_version",
            "reason": "Versioned dependency was frozen in the execution manifest and resolved from the replay snapshot.",
            "resolved_ids": [
                3014,
                3015
            ],
            "source": "locked_manifest_and_replay_provenance"
        },
        "tax_version": {
            "applicability_status": "APPLICABLE_MATCHED",
            "comparison_result": true,
            "expected_ids": [
                2007
            ],
            "identity_type": "tax_version",
            "reason": "Versioned dependency was frozen in the execution manifest and resolved from the replay snapshot.",
            "resolved_ids": [
                2007
            ],
            "source": "locked_manifest_and_replay_provenance"
        }
    }
}
