{
    "artifact_version": "2.0",
    "run_id": "temporal-v2-20260802T184637Z-70ea55a6",
    "case_id": "TEMP-225",
    "generated_at": "2026-08-02T19:03:02.920253Z",
    "schema_ref": "temporal-artifact-schemas/comparator-result.schema.json",
    "payload_sha256": "dbbb30c941da582cf5f09cbf8ea992daf1678590eda33db58d97c65c5b339050",
    "payload": {
        "attempts": [
            {
                "differences": [],
                "metrics": {
                    "component_amount": {
                        "matched": 2,
                        "total": 2
                    },
                    "component_presence": {
                        "matched": 2,
                        "total": 2
                    },
                    "component_provenance": {
                        "matched": 8,
                        "total": 8
                    },
                    "component_type": {
                        "matched": 2,
                        "total": 2
                    },
                    "facts_hash": {
                        "matched": 1,
                        "total": 1
                    },
                    "output_hash": {
                        "matched": 1,
                        "total": 1
                    },
                    "provenance": {
                        "matched": 9,
                        "total": 9
                    },
                    "ruleset_hash": {
                        "matched": 1,
                        "total": 1
                    },
                    "summary": {
                        "matched": 4,
                        "total": 4
                    }
                },
                "status": "MATCHED"
            },
            {
                "differences": [],
                "metrics": {
                    "component_amount": {
                        "matched": 2,
                        "total": 2
                    },
                    "component_presence": {
                        "matched": 2,
                        "total": 2
                    },
                    "component_provenance": {
                        "matched": 8,
                        "total": 8
                    },
                    "component_type": {
                        "matched": 2,
                        "total": 2
                    },
                    "facts_hash": {
                        "matched": 1,
                        "total": 1
                    },
                    "output_hash": {
                        "matched": 1,
                        "total": 1
                    },
                    "provenance": {
                        "matched": 9,
                        "total": 9
                    },
                    "ruleset_hash": {
                        "matched": 1,
                        "total": 1
                    },
                    "summary": {
                        "matched": 4,
                        "total": 4
                    }
                },
                "status": "MATCHED"
            }
        ],
        "matched_repeats": 2,
        "repeat_count": 2,
        "status": "MATCHED"
    }
}
