{
    "artifact_version": "2.0",
    "run_id": "temporal-v2-20260802T184637Z-70ea55a6",
    "case_id": "TEMP-027",
    "generated_at": "2026-08-02T18:59:25.819330Z",
    "schema_ref": "temporal-artifact-schemas/side-effect-result.schema.json",
    "payload_sha256": "20750f5cd21ed316214df17e96a997e9c1b913b2d6d429f1c572ee3c14109cbd",
    "payload": {
        "result": "PASS",
        "salary_side_effect_count": 0,
        "salary_state_sha256_after": "dd13a8b2205bf4a0d85490d76f4d167cb0cfe83d0f40bacd25f473641345f9bd",
        "salary_state_sha256_before": "dd13a8b2205bf4a0d85490d76f4d167cb0cfe83d0f40bacd25f473641345f9bd"
    }
}
