{
    "artifact_version": "2.0",
    "run_id": "temporal-v2-20260813T195025Z-9379cd45",
    "case_id": "TEMP-073",
    "generated_at": "2026-08-13T20:11:59.346206Z",
    "schema_ref": "temporal-artifact-schemas/artifact-hashes.schema.json",
    "payload_sha256": "1d8213824c2f50ba5f4b39c1d95bef9436fd661f215de4ae7f71d360b57da8e2",
    "payload": {
        "artifacts": {
            "attempts/repeat-1/comparator-result.json": "0a7e78528ab170e2cb03d665b3cca075a0ffe5136881edf1f3feaac37e3307e1",
            "attempts/repeat-1/correlation-events.jsonl": "88e65fc1473fb68c03fae5f7508313ef3661020147075ee0d5f8e7643a35f959",
            "attempts/repeat-1/forbidden-query-trace.json": "fb2e113d4e0ef4f2943bda4a0a2c9c100398f2aa9fc55ae250b8678f4c7f886a",
            "attempts/repeat-1/replay-request.json": "d9fecc9c6be4281baf096b1d517ac1b64394b8ad31eb8ea9655e16b504b49819",
            "attempts/repeat-1/replay-response.json": "31743b95fb642ff7bcf0d0b0b1ea74c1e1b27244102f4314a7aadc98694cf32a",
            "attempts/repeat-1/side-effect-check.json": "b3364200da2e499c684026563b0a20d04f975cb9ad228859bb031ba88be43e44",
            "attempts/repeat-1/version-applicability.json": "036c457bc0ea8db66ccdd755dddfec36754ecac7d4b7176e2f94f90e21905f9d",
            "attempts/repeat-2/comparator-result.json": "d614795104f0cd4caf6959c2580363fb54ee90387ee9ca4a795ff524f8104a1a",
            "attempts/repeat-2/correlation-events.jsonl": "88eff2993855cc837c4d88b4ba02237fb5fc7d68219f07ed3722e04ff1cde9a1",
            "attempts/repeat-2/forbidden-query-trace.json": "54f0b337656914f314757f90260b6a746a59930038d7c47924e857c39f5a0d0e",
            "attempts/repeat-2/replay-request.json": "b58f54beeb7edba5906f541f40b299cd6643a0d259e743318a0fb69d09fe3586",
            "attempts/repeat-2/replay-response.json": "347fb450abbb2fd27f6e99614d71f3fc05f2c40c30360eef03505bfbe524e1d6",
            "attempts/repeat-2/side-effect-check.json": "a870b50712c5c9483e2f2a9f9d53c534da44ae7427cfc6f2b0dc4c6e1896aa0f",
            "attempts/repeat-2/version-applicability.json": "9a5353719b78bbad7f9486540ad82fe11ae9cae4597d0c2dec6609322935db92",
            "comparator-result.json": "0d131f3f870cf9bb17ededf44228a9dc003cdc30e2cc77ceb26e422626d9c866",
            "correlation-events.jsonl": "f76d5888974df85faf31796078ef2c26800e786e810b330b125bcc7ca3015c18",
            "forbidden-query-trace.json": "5755a1c198ddb5dcac5fce5a01c8ea6f516d89469840b065f0bfabda8d710eb1",
            "manifest.json": "da6e3d4ca7ed2226bb08dc2eb954d12fe81e765d34098cbdc879bc224d949a6c",
            "original-output.json": "b9dbec4ed90ae661b327d3f8ad1f07a9b5e1d0a63527bfbd43bd86512b2eb7f4",
            "replay-request.json": "be26d36d2fc1a323fc07306e8ae492069f00b3f5ae2051bffd8baa4500e73f45",
            "replay-response.json": "573a0d94d8944453460985e8fb6c6fab88c2fa835085fe5f720769e4cf2331f2",
            "side-effect-check.json": "430a3fe0a9d509497ea0b52a13506c864945e256522cd8a351bfaf1447539de0",
            "version-applicability.json": "db7c4474be2846827a33260d7581a6db41e32d80a35fbd4d81f4cb4d19b57496"
        }
    }
}
