{
    "artifact_version": "2.0",
    "run_id": "temporal-v2-20260811T085034Z-9e6b3f3c",
    "case_id": "TEMP-246",
    "generated_at": "2026-08-11T09:16:33.759350Z",
    "schema_ref": "temporal-artifact-schemas/artifact-hashes.schema.json",
    "payload_sha256": "e56887583e7285641c8899f2ac7ba19b77e7792c87a2799fc5ba0eeab97c98a7",
    "payload": {
        "artifacts": {
            "attempts/repeat-1/comparator-result.json": "5c498332f2a884e8b14e9cc29649102957626cf3989737851dcae02fade68fd1",
            "attempts/repeat-1/correlation-events.jsonl": "04297e00b0a3ed8da645c9fa86f0bad0ac8bfc0bf91682a88a31fade93ca194c",
            "attempts/repeat-1/forbidden-query-trace.json": "224cd19a2cecf0f37d4a4690f40abb1dee108e5e536c717ffd176c2e49b8c592",
            "attempts/repeat-1/replay-request.json": "adf1e4f5b2edbb60fad3b51a5a112d2b65759b89e1f2012e61a0890051436739",
            "attempts/repeat-1/replay-response.json": "5210a5d5fb47c897c7331af09716eb0f7edc8b1ba3970a7b1e88c16506dc3389",
            "attempts/repeat-1/side-effect-check.json": "bed97ce6c9879104a8c30fb88b182cb5903c5a9c2b8276b472213f6cf2699b3f",
            "attempts/repeat-1/version-applicability.json": "a9d36dfbcb5c74a19d78acf978754ba3fb9c98c2b07599d776f46039ea9b6033",
            "attempts/repeat-2/comparator-result.json": "b000537ae1fbc04868135255bd8f70580761152fd7654fa23153b7ca37c294c3",
            "attempts/repeat-2/correlation-events.jsonl": "e00251a25d1dc5d1ae5b53d0cc8590c16032d0a75a50b2a89175bb77681000a7",
            "attempts/repeat-2/forbidden-query-trace.json": "32199639a2ec526a5adbee924b01cafa07f8e36c29f4c74064a7889d8c1a0d4d",
            "attempts/repeat-2/replay-request.json": "4d09570cf63091fecef6a336952f8baceff0929c74d265aa10f69c16841dee8e",
            "attempts/repeat-2/replay-response.json": "ddd1551c17abf7c7bf6bb814ebdaacc4debcae0f7a66f412f3435c00f86cce76",
            "attempts/repeat-2/side-effect-check.json": "20e26be282eafc671deec2b59a2f43ba63946c1c6d0a877bd49e0afa24f35329",
            "attempts/repeat-2/version-applicability.json": "c96fe5115e60fb2fcf6b7e8a89957d1e1b6b00e41208a0915146c49aed666d91",
            "comparator-result.json": "01768e412ae2dac8d8c18814ae6bf11a7a73601085a717c6d68eee7e4fc13c04",
            "correlation-events.jsonl": "bd9477e634fe0cfcaec76d593cc822f5b2f30e86caebebd9edf8203087248352",
            "forbidden-query-trace.json": "a718c8aa98a0bde07d88d94d0016b907bd920684aa5f73b2548171a50920c9d0",
            "manifest.json": "9c8c03907cd2a60cc767a9426598c9e5e103ae5c33b816b07e1bd5866e6d1291",
            "original-output.json": "053b7d90333bb9629a7cd771abe9437a2609c7b36372b81088a0ab7e49619982",
            "replay-request.json": "be00cc3dced0f62f4024b6d2febee964a49e86f8d54cf4729b739ef9e78c19db",
            "replay-response.json": "31b8d6dfff1adabe177d7d6b7b44537ae26ab2458d24559b0567065af88f2108",
            "side-effect-check.json": "14d959776631d1a39718d0fdd0e416539e239f9a72241a376d93d8dfe9b51061",
            "version-applicability.json": "f1b19c2d1c5616acb994407ed8b3fdea79436f287ad676f20012de64dac45a78"
        }
    }
}
