{
    "artifact_version": "2.0",
    "run_id": "temporal-v2-20260811T085034Z-9e6b3f3c",
    "case_id": "TEMP-395",
    "generated_at": "2026-08-11T09:18:23.431303Z",
    "schema_ref": "temporal-artifact-schemas/side-effect-result.schema.json",
    "payload_sha256": "3c27ca2596183aebd3f2dae29e7cc00b9f081707fec6bb912a9acd8aa50d387a",
    "payload": {
        "result": "PASS",
        "salary_side_effect_count": 0,
        "salary_state_sha256_after": "a4448c95e98b576daaacc0435f4853c819bb8d488de4f3051da8be6da72aa5a7",
        "salary_state_sha256_before": "a4448c95e98b576daaacc0435f4853c819bb8d488de4f3051da8be6da72aa5a7"
    }
}
