{
    "artifact_version": "2.0",
    "run_id": "temporal-v2-20260811T085034Z-9e6b3f3c",
    "case_id": "TEMP-115",
    "generated_at": "2026-08-11T09:15:05.891622Z",
    "schema_ref": "temporal-artifact-schemas/replay-response.schema.json",
    "payload_sha256": "4f374c4f59d9c7310b4d666ec1fe877cc18765ae02763864c48c2fb09154ac81",
    "payload": {
        "components": [
            {
                "amount": "10700.000000",
                "code": "BONUS",
                "contributor_rule_ids": [
                    "rule-version-3014"
                ],
                "contributor_rule_version_ids": [
                    3014
                ],
                "source_rule_id": "rule-version-3014",
                "source_rule_version_id": 3014,
                "type": "EARNING"
            }
        ],
        "correlation_events": [
            {
                "event": "REQUEST_RECEIVED",
                "event_id": "99e31269-b9cd-418d-8228-9630d21efa52",
                "execution_uuid": "9b342b26-2632-4a92-a9b8-6c809ef6773b",
                "grule_execution_id": "b22bd50b-9c8c-4ff6-8780-1d1955d2c14f",
                "laravel_correlation_id": "4b910065-daac-4063-ab21-251f58a4210f",
                "occurred_at": "2026-08-11T09:15:05.405164012Z",
                "replay_uuid": "e9968433-d0fb-46fb-8f28-fd442709c057",
                "request_id": "7cb2b7a0-08f8-4182-8769-3b3d97387ee3",
                "stage": "GO_HTTP",
                "translator_trace_id": "3480d363-b500-4fae-bbe6-07072eb898b6"
            },
            {
                "event": "SCHEMA_VALIDATED",
                "event_id": "31c0de46-8f22-44a4-87f6-e8b144be919d",
                "execution_uuid": "9b342b26-2632-4a92-a9b8-6c809ef6773b",
                "grule_execution_id": "b22bd50b-9c8c-4ff6-8780-1d1955d2c14f",
                "laravel_correlation_id": "4b910065-daac-4063-ab21-251f58a4210f",
                "occurred_at": "2026-08-11T09:15:05.405169112Z",
                "replay_uuid": "e9968433-d0fb-46fb-8f28-fd442709c057",
                "request_id": "7cb2b7a0-08f8-4182-8769-3b3d97387ee3",
                "stage": "TPR_IR_VALIDATOR",
                "translator_trace_id": "3480d363-b500-4fae-bbe6-07072eb898b6"
            },
            {
                "event": "HASHES_VALIDATED",
                "event_id": "a71d7e02-8a7d-499d-86b2-4cc1410d1f3c",
                "execution_uuid": "9b342b26-2632-4a92-a9b8-6c809ef6773b",
                "grule_execution_id": "b22bd50b-9c8c-4ff6-8780-1d1955d2c14f",
                "laravel_correlation_id": "4b910065-daac-4063-ab21-251f58a4210f",
                "occurred_at": "2026-08-11T09:15:05.406380612Z",
                "replay_uuid": "e9968433-d0fb-46fb-8f28-fd442709c057",
                "request_id": "7cb2b7a0-08f8-4182-8769-3b3d97387ee3",
                "stage": "TPR_IR_VALIDATOR",
                "translator_trace_id": "3480d363-b500-4fae-bbe6-07072eb898b6"
            },
            {
                "event": "TRANSLATION_STARTED",
                "event_id": "b00b5d48-d634-4523-b88d-9f5cd12d41ed",
                "execution_uuid": "9b342b26-2632-4a92-a9b8-6c809ef6773b",
                "grule_execution_id": "b22bd50b-9c8c-4ff6-8780-1d1955d2c14f",
                "laravel_correlation_id": "4b910065-daac-4063-ab21-251f58a4210f",
                "occurred_at": "2026-08-11T09:15:05.407058112Z",
                "replay_uuid": "e9968433-d0fb-46fb-8f28-fd442709c057",
                "request_id": "7cb2b7a0-08f8-4182-8769-3b3d97387ee3",
                "stage": "GRL_TRANSLATOR",
                "translator_trace_id": "3480d363-b500-4fae-bbe6-07072eb898b6"
            },
            {
                "event": "TRANSLATION_FINISHED",
                "event_id": "c2b4011f-b167-4cc3-afed-0206e1ebd5d8",
                "execution_uuid": "9b342b26-2632-4a92-a9b8-6c809ef6773b",
                "grule_execution_id": "b22bd50b-9c8c-4ff6-8780-1d1955d2c14f",
                "laravel_correlation_id": "4b910065-daac-4063-ab21-251f58a4210f",
                "occurred_at": "2026-08-11T09:15:05.407190412Z",
                "replay_uuid": "e9968433-d0fb-46fb-8f28-fd442709c057",
                "request_id": "7cb2b7a0-08f8-4182-8769-3b3d97387ee3",
                "stage": "GRL_TRANSLATOR",
                "translator_trace_id": "3480d363-b500-4fae-bbe6-07072eb898b6"
            },
            {
                "event": "EXECUTION_STARTED",
                "event_id": "91b495cf-4d68-49ac-aa2f-0f33b798fea3",
                "execution_uuid": "9b342b26-2632-4a92-a9b8-6c809ef6773b",
                "grule_execution_id": "b22bd50b-9c8c-4ff6-8780-1d1955d2c14f",
                "laravel_correlation_id": "4b910065-daac-4063-ab21-251f58a4210f",
                "occurred_at": "2026-08-11T09:15:05.407193312Z",
                "replay_uuid": "e9968433-d0fb-46fb-8f28-fd442709c057",
                "request_id": "7cb2b7a0-08f8-4182-8769-3b3d97387ee3",
                "stage": "GRULE",
                "translator_trace_id": "3480d363-b500-4fae-bbe6-07072eb898b6"
            },
            {
                "event": "EXECUTION_FINISHED",
                "event_id": "dc44b511-4dce-4e63-a98e-f660d1d9c7b3",
                "execution_uuid": "9b342b26-2632-4a92-a9b8-6c809ef6773b",
                "grule_execution_id": "b22bd50b-9c8c-4ff6-8780-1d1955d2c14f",
                "laravel_correlation_id": "4b910065-daac-4063-ab21-251f58a4210f",
                "occurred_at": "2026-08-11T09:15:05.411241313Z",
                "replay_uuid": "e9968433-d0fb-46fb-8f28-fd442709c057",
                "request_id": "7cb2b7a0-08f8-4182-8769-3b3d97387ee3",
                "stage": "GRULE",
                "translator_trace_id": "3480d363-b500-4fae-bbe6-07072eb898b6"
            },
            {
                "event": "RESPONSE_GENERATED",
                "event_id": "9749fa51-f51b-4667-9e03-3d3e9b162eed",
                "execution_uuid": "9b342b26-2632-4a92-a9b8-6c809ef6773b",
                "grule_execution_id": "b22bd50b-9c8c-4ff6-8780-1d1955d2c14f",
                "laravel_correlation_id": "4b910065-daac-4063-ab21-251f58a4210f",
                "occurred_at": "2026-08-11T09:15:05.411542713Z",
                "replay_uuid": "e9968433-d0fb-46fb-8f28-fd442709c057",
                "request_id": "7cb2b7a0-08f8-4182-8769-3b3d97387ee3",
                "stage": "GO_HTTP",
                "translator_trace_id": "3480d363-b500-4fae-bbe6-07072eb898b6"
            }
        ],
        "execution_uuid": "9b342b26-2632-4a92-a9b8-6c809ef6773b",
        "generated_grl": "\nrule TPR_de2dcb1d70d71955_0 \"TPR-IR 1.0\" salience 100 {\nwhen\n\t(employee.Status == \"aktif\")\nthen\n\tout.Emit(\"ADD_COMPONENT\", \"BONUS\", rates.Value(\"bonus_rate\"), 100, \"rule-version-3014\", 3014, 0);\n\tRetract(\"TPR_de2dcb1d70d71955_0\");\n}\n\nrule TPR_de2dca1d70d717a2_0 \"TPR-IR 1.0\" salience 50 {\nwhen\n\t(attendance.LateMinutes > 0.0)\nthen\n\tout.Emit(\"ADD_COMPONENT\", \"LATE_DEDUCTION\", (attendance.LateMinutes * rates.Value(\"late_rate\")), 50, \"rule-version-3015\", 3015, 1);\n\tRetract(\"TPR_de2dca1d70d717a2_0\");\n}\n",
        "generated_grl_sha256": "e1095ebf2f209933bcca21f2eec543624d4959caca80fa99fdfd2b6033e8e10f",
        "grule_execution_id": "b22bd50b-9c8c-4ff6-8780-1d1955d2c14f",
        "laravel_correlation_id": "4b910065-daac-4063-ab21-251f58a4210f",
        "matches_original_hash": true,
        "mode": "TEMPORAL_REPLAY",
        "output_sha256": "06c3300fbb4e4da18a7089d684a0c4f23f9bf6fcdda80c99fcb484d01de0d3ff",
        "provenance": {
            "engine_version": "go-grule-tpr-engine-1.0",
            "execution_uuid": "9b342b26-2632-4a92-a9b8-6c809ef6773b",
            "facts_sha256": "bf6d04512ec64a249d297e512ba1bb6ac13fb6e02d7d6df90a27aadab31c99a1",
            "rate_version_ids": [
                1007
            ],
            "request_id": "7328d464-a01f-425b-971c-8923accad583",
            "rule_version_ids": [
                3014,
                3015
            ],
            "ruleset_sha256": "d5f27dcfa643d8c3a588a0024b9f1b80f98941a94d9b9f9b9a394fbc635994bd",
            "tax_version_ids": [
                2007
            ],
            "translator_version": "laravel-go-tpr-translator-1.0"
        },
        "replay_uuid": "e9968433-d0fb-46fb-8f28-fd442709c057",
        "request_id": "7cb2b7a0-08f8-4182-8769-3b3d97387ee3",
        "rounding_trace": [
            {
                "component_code": "BONUS",
                "operation_timestamp": "2026-08-11T09:15:05.411328213Z",
                "raw_candidate_decimal": "10700",
                "rounded_result": "10700.000000",
                "rounding_mode": "HALF_UP",
                "rounding_quantum": "0.000001",
                "scale_before_rounding": 0,
                "source_rule": "rule-version-3014"
            }
        ],
        "summary": {
            "basic_salary": "4007000.000000",
            "gross_salary": "4017700.000000",
            "net_salary": "4017700.000000",
            "total_deductions": "0.000000"
        },
        "translator_trace_id": "3480d363-b500-4fae-bbe6-07072eb898b6"
    }
}
