{
    "artifact_version": "2.0",
    "run_id": "temporal-v2-20260802T184637Z-70ea55a6",
    "case_id": "TEMP-385",
    "generated_at": "2026-08-02T19:05:55.199325Z",
    "schema_ref": "temporal-artifact-schemas/replay-response.schema.json",
    "payload_sha256": "1f1898defebe76829af750df0dd8111316af05b70759099f436532e343c98655",
    "payload": {
        "components": [
            {
                "amount": "11300.000000",
                "code": "BONUS",
                "contributor_rule_ids": [
                    "rule-version-3026"
                ],
                "contributor_rule_version_ids": [
                    3026
                ],
                "source_rule_id": "rule-version-3026",
                "source_rule_version_id": 3026,
                "type": "EARNING"
            },
            {
                "amount": "2052.000000",
                "code": "LATE_DEDUCTION",
                "contributor_rule_ids": [
                    "rule-version-3027"
                ],
                "contributor_rule_version_ids": [
                    3027
                ],
                "source_rule_id": "rule-version-3027",
                "source_rule_version_id": 3027,
                "type": "DEDUCTION"
            }
        ],
        "correlation_events": [
            {
                "event": "REQUEST_RECEIVED",
                "event_id": "96191700-e9dc-492e-b511-a7b2cd637a5b",
                "execution_uuid": "0a8d6f28-230d-4d6e-b097-f213cb18eaf5",
                "grule_execution_id": "5e3fffb4-923c-438a-907a-5a4600cb5cf7",
                "laravel_correlation_id": "9f8a3518-6607-4124-933a-5d3c5181406c",
                "occurred_at": "2026-08-02T19:05:54.4715848Z",
                "replay_uuid": "a8b0b737-b1d2-4eb9-84b6-5b46e76e1647",
                "request_id": "4357edc2-3cb7-4376-92cf-72ceb3f2dbe3",
                "stage": "GO_HTTP",
                "translator_trace_id": "5fef3351-a50c-4901-94ac-ea97e54d467b"
            },
            {
                "event": "SCHEMA_VALIDATED",
                "event_id": "97cff71a-f68b-471c-b0bc-af15c82ed38b",
                "execution_uuid": "0a8d6f28-230d-4d6e-b097-f213cb18eaf5",
                "grule_execution_id": "5e3fffb4-923c-438a-907a-5a4600cb5cf7",
                "laravel_correlation_id": "9f8a3518-6607-4124-933a-5d3c5181406c",
                "occurred_at": "2026-08-02T19:05:54.4715848Z",
                "replay_uuid": "a8b0b737-b1d2-4eb9-84b6-5b46e76e1647",
                "request_id": "4357edc2-3cb7-4376-92cf-72ceb3f2dbe3",
                "stage": "TPR_IR_VALIDATOR",
                "translator_trace_id": "5fef3351-a50c-4901-94ac-ea97e54d467b"
            },
            {
                "event": "HASHES_VALIDATED",
                "event_id": "14d604de-3d2e-40f4-846b-be9c0ef68a1d",
                "execution_uuid": "0a8d6f28-230d-4d6e-b097-f213cb18eaf5",
                "grule_execution_id": "5e3fffb4-923c-438a-907a-5a4600cb5cf7",
                "laravel_correlation_id": "9f8a3518-6607-4124-933a-5d3c5181406c",
                "occurred_at": "2026-08-02T19:05:54.4715848Z",
                "replay_uuid": "a8b0b737-b1d2-4eb9-84b6-5b46e76e1647",
                "request_id": "4357edc2-3cb7-4376-92cf-72ceb3f2dbe3",
                "stage": "TPR_IR_VALIDATOR",
                "translator_trace_id": "5fef3351-a50c-4901-94ac-ea97e54d467b"
            },
            {
                "event": "TRANSLATION_STARTED",
                "event_id": "d2852646-8cba-4973-abac-fe2c0c4eb57e",
                "execution_uuid": "0a8d6f28-230d-4d6e-b097-f213cb18eaf5",
                "grule_execution_id": "5e3fffb4-923c-438a-907a-5a4600cb5cf7",
                "laravel_correlation_id": "9f8a3518-6607-4124-933a-5d3c5181406c",
                "occurred_at": "2026-08-02T19:05:54.4715848Z",
                "replay_uuid": "a8b0b737-b1d2-4eb9-84b6-5b46e76e1647",
                "request_id": "4357edc2-3cb7-4376-92cf-72ceb3f2dbe3",
                "stage": "GRL_TRANSLATOR",
                "translator_trace_id": "5fef3351-a50c-4901-94ac-ea97e54d467b"
            },
            {
                "event": "TRANSLATION_FINISHED",
                "event_id": "63daa8e4-391b-4be3-aee7-c779533c8f58",
                "execution_uuid": "0a8d6f28-230d-4d6e-b097-f213cb18eaf5",
                "grule_execution_id": "5e3fffb4-923c-438a-907a-5a4600cb5cf7",
                "laravel_correlation_id": "9f8a3518-6607-4124-933a-5d3c5181406c",
                "occurred_at": "2026-08-02T19:05:54.4715848Z",
                "replay_uuid": "a8b0b737-b1d2-4eb9-84b6-5b46e76e1647",
                "request_id": "4357edc2-3cb7-4376-92cf-72ceb3f2dbe3",
                "stage": "GRL_TRANSLATOR",
                "translator_trace_id": "5fef3351-a50c-4901-94ac-ea97e54d467b"
            },
            {
                "event": "EXECUTION_STARTED",
                "event_id": "2f026e5e-0d29-47d6-9600-e4ce2872412c",
                "execution_uuid": "0a8d6f28-230d-4d6e-b097-f213cb18eaf5",
                "grule_execution_id": "5e3fffb4-923c-438a-907a-5a4600cb5cf7",
                "laravel_correlation_id": "9f8a3518-6607-4124-933a-5d3c5181406c",
                "occurred_at": "2026-08-02T19:05:54.4715848Z",
                "replay_uuid": "a8b0b737-b1d2-4eb9-84b6-5b46e76e1647",
                "request_id": "4357edc2-3cb7-4376-92cf-72ceb3f2dbe3",
                "stage": "GRULE",
                "translator_trace_id": "5fef3351-a50c-4901-94ac-ea97e54d467b"
            },
            {
                "event": "EXECUTION_FINISHED",
                "event_id": "dd385449-b728-44d4-9b1e-55e98a2b9165",
                "execution_uuid": "0a8d6f28-230d-4d6e-b097-f213cb18eaf5",
                "grule_execution_id": "5e3fffb4-923c-438a-907a-5a4600cb5cf7",
                "laravel_correlation_id": "9f8a3518-6607-4124-933a-5d3c5181406c",
                "occurred_at": "2026-08-02T19:05:54.5915213Z",
                "replay_uuid": "a8b0b737-b1d2-4eb9-84b6-5b46e76e1647",
                "request_id": "4357edc2-3cb7-4376-92cf-72ceb3f2dbe3",
                "stage": "GRULE",
                "translator_trace_id": "5fef3351-a50c-4901-94ac-ea97e54d467b"
            },
            {
                "event": "RESPONSE_GENERATED",
                "event_id": "277e6534-4145-44ee-bcde-3874315533a7",
                "execution_uuid": "0a8d6f28-230d-4d6e-b097-f213cb18eaf5",
                "grule_execution_id": "5e3fffb4-923c-438a-907a-5a4600cb5cf7",
                "laravel_correlation_id": "9f8a3518-6607-4124-933a-5d3c5181406c",
                "occurred_at": "2026-08-02T19:05:54.5915213Z",
                "replay_uuid": "a8b0b737-b1d2-4eb9-84b6-5b46e76e1647",
                "request_id": "4357edc2-3cb7-4376-92cf-72ceb3f2dbe3",
                "stage": "GO_HTTP",
                "translator_trace_id": "5fef3351-a50c-4901-94ac-ea97e54d467b"
            }
        ],
        "execution_uuid": "0a8d6f28-230d-4d6e-b097-f213cb18eaf5",
        "generated_grl": "\nrule TPR_de31471d70da21e0_0 \"TPR-IR 1.0\" salience 100 {\nwhen\n\t(employee.Status == \"aktif\")\nthen\n\tout.Emit(\"ADD_COMPONENT\", \"BONUS\", rates.Value(\"bonus_rate\"), 100, \"rule-version-3026\", 3026, 0);\n\tRetract(\"TPR_de31471d70da21e0_0\");\n}\n\nrule TPR_de31481d70da2393_0 \"TPR-IR 1.0\" salience 50 {\nwhen\n\t(attendance.LateMinutes > 0.0)\nthen\n\tout.Emit(\"ADD_COMPONENT\", \"LATE_DEDUCTION\", (attendance.LateMinutes * rates.Value(\"late_rate\")), 50, \"rule-version-3027\", 3027, 1);\n\tRetract(\"TPR_de31481d70da2393_0\");\n}\n",
        "generated_grl_sha256": "29b3db969d9e5a72a4dd43da58dfc1222b6e50ef8ce7b51cec5859741fc2872f",
        "grule_execution_id": "5e3fffb4-923c-438a-907a-5a4600cb5cf7",
        "laravel_correlation_id": "9f8a3518-6607-4124-933a-5d3c5181406c",
        "matches_original_hash": true,
        "mode": "TEMPORAL_REPLAY",
        "output_sha256": "b0edae1c52568194391feb7326d96fc62780a6c89cf7a35dedcc979054ed5bb3",
        "provenance": {
            "engine_version": "go-grule-tpr-engine-1.0",
            "execution_uuid": "0a8d6f28-230d-4d6e-b097-f213cb18eaf5",
            "facts_sha256": "995c32454d45007ff5af960522a3be886c7a276f1c9220a67148461e03ad8da4",
            "rate_version_ids": [
                1013
            ],
            "request_id": "37968558-476c-4d07-8f53-bc3bcc757fed",
            "rule_version_ids": [
                3026,
                3027
            ],
            "ruleset_sha256": "719f7b47bbc66aac262bf1caaf3fbe07811b35ea0b85ceb6a4f7a017774c181d",
            "tax_version_ids": [
                2013
            ],
            "translator_version": "laravel-go-tpr-translator-1.0"
        },
        "replay_uuid": "a8b0b737-b1d2-4eb9-84b6-5b46e76e1647",
        "request_id": "4357edc2-3cb7-4376-92cf-72ceb3f2dbe3",
        "rounding_trace": [
            {
                "component_code": "BONUS",
                "operation_timestamp": "2026-08-02T19:05:54.5915213Z",
                "raw_candidate_decimal": "11300",
                "rounded_result": "11300.000000",
                "rounding_mode": "HALF_UP",
                "rounding_quantum": "0.000001",
                "scale_before_rounding": 0,
                "source_rule": "rule-version-3026"
            },
            {
                "component_code": "LATE_DEDUCTION",
                "operation_timestamp": "2026-08-02T19:05:54.5915213Z",
                "raw_candidate_decimal": "2052",
                "rounded_result": "2052.000000",
                "rounding_mode": "HALF_UP",
                "rounding_quantum": "0.000001",
                "scale_before_rounding": 0,
                "source_rule": "rule-version-3027"
            }
        ],
        "summary": {
            "basic_salary": "5513000.000000",
            "gross_salary": "5524300.000000",
            "net_salary": "5522248.000000",
            "total_deductions": "2052.000000"
        },
        "translator_trace_id": "5fef3351-a50c-4901-94ac-ea97e54d467b"
    }
}
