{
    "artifact_version": "2.0",
    "run_id": "temporal-v2-20260813T195025Z-9379cd45",
    "case_id": "TEMP-385",
    "generated_at": "2026-08-13T20:17:52.294142Z",
    "schema_ref": "temporal-artifact-schemas/forbidden-lookup-trace.schema.json",
    "payload_sha256": "6aba2a5f69fa15041026f0064210ca78f6335a9ab46b58beff80344da0c08fac",
    "payload": {
        "blocked_calls": [],
        "case_id": "TEMP-385",
        "forbidden_lookup_count": 0,
        "observed_queries": [],
        "repeat": 1,
        "result": "PASS"
    }
}
