{
    "artifact_version": "2.0",
    "run_id": "temporal-v2-20260811T085034Z-9e6b3f3c",
    "case_id": "TAX-V2-004",
    "generated_at": "2026-08-11T09:18:30.730957Z",
    "schema_ref": "temporal-artifact-schemas/forbidden-lookup-trace.schema.json",
    "payload_sha256": "a75a1fb13e1ebdd4ef14733f220ecd942346506ed4f88c3450e3534033b1b040",
    "payload": {
        "blocked_calls": [],
        "case_id": "TAX-V2-004",
        "forbidden_lookup_count": 0,
        "observed_queries": [],
        "repeat": 2,
        "result": "PASS"
    }
}
