{
    "artifact_version": "2.0",
    "run_id": "temporal-v2-20260813T211003Z-a7304d0d",
    "case_id": "TEMP-067",
    "generated_at": "2026-08-13T21:33:18.444524Z",
    "schema_ref": "temporal-artifact-schemas/artifact-hashes.schema.json",
    "payload_sha256": "ec3acb48f0f3b4d01e2c6ea0f7ac7e2bc140d318697a08b439d0e6e563c3e66a",
    "payload": {
        "artifacts": {
            "attempts/repeat-1/comparator-result.json": "bf7f2ee2f319f11c99673161cff39421664edd041afbeaa2a3c8809205c5d092",
            "attempts/repeat-1/correlation-events.jsonl": "e83acfa0fd166d46a36bba48972d1fe6352d291550c8171ed48a757214deaffc",
            "attempts/repeat-1/forbidden-query-trace.json": "fd88fed033ba9ef4ae5ff1946cb243c72cad84c90dbb91d82fe70ef1449f745e",
            "attempts/repeat-1/replay-request.json": "42509d266b1432c2b2cfca49457b12334a13545cd902a3527d7ecad6ad5453a0",
            "attempts/repeat-1/replay-response.json": "7debd3cfb9e8861829803eaa28bd4fb1f5e8226e309d1a176d0cedc5a365db33",
            "attempts/repeat-1/side-effect-check.json": "13712f95b7a245177f2cbca894575aa3daa49066110b812ddb35d674a07ff65c",
            "attempts/repeat-1/version-applicability.json": "d930cebf3f483c95496430e31589f29b014bf7f5f8de8d3391a5e2a1ba367248",
            "attempts/repeat-2/comparator-result.json": "fef5854efdc25755ecb7139f86fb1fcbe2211374d8f26906a9064064498310e8",
            "attempts/repeat-2/correlation-events.jsonl": "87a0874e0d31b4b225ac0c0496b96436b732a40ff3cb9e50980e2ea712157b07",
            "attempts/repeat-2/forbidden-query-trace.json": "e1c4e5648418485bf8cbc5293828903ed0092b45bebec5e4cc7677b9cbf32781",
            "attempts/repeat-2/replay-request.json": "778a3682a1905969cfef1c03e7a0c2983ab37a4b97378ef94fcdc23ccfd47600",
            "attempts/repeat-2/replay-response.json": "a28122a9460f55af84277f78f1254d3d60ebc8fdcc28e10fe917b2af8bbf944f",
            "attempts/repeat-2/side-effect-check.json": "abd8b0109c010634f4046c27edafc17be462ba7de65fb7c037bcd63fe0384adc",
            "attempts/repeat-2/version-applicability.json": "8f3ebd0bd32700a7b501823758e30198501b574e87c9b4f385edc90a30105597",
            "comparator-result.json": "4f78e8e165e2464949bb76dadd89a08c2de75d7750aa52379a3632ab8083f61b",
            "correlation-events.jsonl": "1ab13b138930a27d7f51ee4adbd7ef36c931d670f492eab2ea3fb19493e7143b",
            "forbidden-query-trace.json": "1c8d89eaee842555586d727f9ddcb287d5ed16d62bfabd1652567107a0e8cb3c",
            "manifest.json": "c34e421f42d323535bc17cdcde85a79709c3578119a186c6278bd2b66c0fe55f",
            "original-output.json": "f4be372f4dca60425901bacef4667f98a73ef47cb9bc77feef38679f32d99525",
            "replay-request.json": "93de1cbb043742731ac8dba800410f7ee1f6de982531dbb2ff4c0b1157fcc62a",
            "replay-response.json": "4addfe452d2dc45297e9fbfa56c065855faa9ad5c60e0ebb71f080067a889638",
            "side-effect-check.json": "f4c91f300d7ed39c4e68a305094e5fde03d65efdb9cab2621d6a35455049db6a",
            "version-applicability.json": "35ed16b986bcf54a4273576202945c01eb418c6659334d6d5255b0fa3b21772a"
        }
    }
}
