{
    "artifact_version": "2.0",
    "run_id": "temporal-v2-20260813T211003Z-a7304d0d",
    "case_id": "TEMP-117",
    "generated_at": "2026-08-13T21:33:56.591249Z",
    "schema_ref": "temporal-artifact-schemas/side-effect-result.schema.json",
    "payload_sha256": "3463c4d8b58e7c5bee8df744faf159337d4fbf7570675752af2df84571a9466a",
    "payload": {
        "result": "PASS",
        "salary_side_effect_count": 0,
        "salary_state_sha256_after": "697a41bb2809d85d86d3dc2a6173813290d7894e48306d159b752e104d03c1ba",
        "salary_state_sha256_before": "697a41bb2809d85d86d3dc2a6173813290d7894e48306d159b752e104d03c1ba"
    }
}
