{
    "artifact_version": "2.0",
    "run_id": "temporal-v2-20260802T184637Z-70ea55a6",
    "case_id": "TEMP-328",
    "generated_at": "2026-08-02T19:04:52.715366Z",
    "schema_ref": "temporal-artifact-schemas/replay-response.schema.json",
    "payload_sha256": "9d95123b3941d63f4f31368df50e3a5181a11d0d1d0a5e5c9a23bf0e6bdc2b63",
    "payload": {
        "components": [
            {
                "amount": "10400.000000",
                "code": "BONUS",
                "contributor_rule_ids": [
                    "rule-version-3008"
                ],
                "contributor_rule_version_ids": [
                    3008
                ],
                "source_rule_id": "rule-version-3008",
                "source_rule_version_id": 3008,
                "type": "EARNING"
            },
            {
                "amount": "7560.000000",
                "code": "LATE_DEDUCTION",
                "contributor_rule_ids": [
                    "rule-version-3009"
                ],
                "contributor_rule_version_ids": [
                    3009
                ],
                "source_rule_id": "rule-version-3009",
                "source_rule_version_id": 3009,
                "type": "DEDUCTION"
            }
        ],
        "correlation_events": [
            {
                "event": "REQUEST_RECEIVED",
                "event_id": "35e52073-0690-4c9b-b868-3bf9e5d80812",
                "execution_uuid": "70a0934e-84e0-4dac-bf51-26a0dc4125c2",
                "grule_execution_id": "dbe0f7e8-26aa-447d-add5-444ddf2fefb5",
                "laravel_correlation_id": "e92f6750-9e00-4bff-a95f-34c3d4c29f50",
                "occurred_at": "2026-08-02T19:04:52.1754462Z",
                "replay_uuid": "58ea13b9-f911-471e-964f-cc075afbf6ca",
                "request_id": "26519a39-252e-4ef9-8730-e5883627f898",
                "stage": "GO_HTTP",
                "translator_trace_id": "7f5e7e63-ec5a-44ca-8905-89699626f100"
            },
            {
                "event": "SCHEMA_VALIDATED",
                "event_id": "023024a9-c45e-49de-b7e6-2b135b09fb35",
                "execution_uuid": "70a0934e-84e0-4dac-bf51-26a0dc4125c2",
                "grule_execution_id": "dbe0f7e8-26aa-447d-add5-444ddf2fefb5",
                "laravel_correlation_id": "e92f6750-9e00-4bff-a95f-34c3d4c29f50",
                "occurred_at": "2026-08-02T19:04:52.1754462Z",
                "replay_uuid": "58ea13b9-f911-471e-964f-cc075afbf6ca",
                "request_id": "26519a39-252e-4ef9-8730-e5883627f898",
                "stage": "TPR_IR_VALIDATOR",
                "translator_trace_id": "7f5e7e63-ec5a-44ca-8905-89699626f100"
            },
            {
                "event": "HASHES_VALIDATED",
                "event_id": "ef8f5008-eb1e-4f62-9f01-da10ec479357",
                "execution_uuid": "70a0934e-84e0-4dac-bf51-26a0dc4125c2",
                "grule_execution_id": "dbe0f7e8-26aa-447d-add5-444ddf2fefb5",
                "laravel_correlation_id": "e92f6750-9e00-4bff-a95f-34c3d4c29f50",
                "occurred_at": "2026-08-02T19:04:52.1754462Z",
                "replay_uuid": "58ea13b9-f911-471e-964f-cc075afbf6ca",
                "request_id": "26519a39-252e-4ef9-8730-e5883627f898",
                "stage": "TPR_IR_VALIDATOR",
                "translator_trace_id": "7f5e7e63-ec5a-44ca-8905-89699626f100"
            },
            {
                "event": "TRANSLATION_STARTED",
                "event_id": "d11a283b-fccd-4133-868d-b64c233408dc",
                "execution_uuid": "70a0934e-84e0-4dac-bf51-26a0dc4125c2",
                "grule_execution_id": "dbe0f7e8-26aa-447d-add5-444ddf2fefb5",
                "laravel_correlation_id": "e92f6750-9e00-4bff-a95f-34c3d4c29f50",
                "occurred_at": "2026-08-02T19:04:52.1754462Z",
                "replay_uuid": "58ea13b9-f911-471e-964f-cc075afbf6ca",
                "request_id": "26519a39-252e-4ef9-8730-e5883627f898",
                "stage": "GRL_TRANSLATOR",
                "translator_trace_id": "7f5e7e63-ec5a-44ca-8905-89699626f100"
            },
            {
                "event": "TRANSLATION_FINISHED",
                "event_id": "e2f9ab82-9da8-4ece-a45d-b9390926e493",
                "execution_uuid": "70a0934e-84e0-4dac-bf51-26a0dc4125c2",
                "grule_execution_id": "dbe0f7e8-26aa-447d-add5-444ddf2fefb5",
                "laravel_correlation_id": "e92f6750-9e00-4bff-a95f-34c3d4c29f50",
                "occurred_at": "2026-08-02T19:04:52.1754462Z",
                "replay_uuid": "58ea13b9-f911-471e-964f-cc075afbf6ca",
                "request_id": "26519a39-252e-4ef9-8730-e5883627f898",
                "stage": "GRL_TRANSLATOR",
                "translator_trace_id": "7f5e7e63-ec5a-44ca-8905-89699626f100"
            },
            {
                "event": "EXECUTION_STARTED",
                "event_id": "0fb405bf-8fbd-4791-bcad-6d3e616ef8a2",
                "execution_uuid": "70a0934e-84e0-4dac-bf51-26a0dc4125c2",
                "grule_execution_id": "dbe0f7e8-26aa-447d-add5-444ddf2fefb5",
                "laravel_correlation_id": "e92f6750-9e00-4bff-a95f-34c3d4c29f50",
                "occurred_at": "2026-08-02T19:04:52.1754462Z",
                "replay_uuid": "58ea13b9-f911-471e-964f-cc075afbf6ca",
                "request_id": "26519a39-252e-4ef9-8730-e5883627f898",
                "stage": "GRULE",
                "translator_trace_id": "7f5e7e63-ec5a-44ca-8905-89699626f100"
            },
            {
                "event": "EXECUTION_FINISHED",
                "event_id": "5139ee6c-f483-4fb8-b6c8-194be00feacc",
                "execution_uuid": "70a0934e-84e0-4dac-bf51-26a0dc4125c2",
                "grule_execution_id": "dbe0f7e8-26aa-447d-add5-444ddf2fefb5",
                "laravel_correlation_id": "e92f6750-9e00-4bff-a95f-34c3d4c29f50",
                "occurred_at": "2026-08-02T19:04:52.1865893Z",
                "replay_uuid": "58ea13b9-f911-471e-964f-cc075afbf6ca",
                "request_id": "26519a39-252e-4ef9-8730-e5883627f898",
                "stage": "GRULE",
                "translator_trace_id": "7f5e7e63-ec5a-44ca-8905-89699626f100"
            },
            {
                "event": "RESPONSE_GENERATED",
                "event_id": "c6207e6a-7111-43b1-9d3d-2d80dabab7db",
                "execution_uuid": "70a0934e-84e0-4dac-bf51-26a0dc4125c2",
                "grule_execution_id": "dbe0f7e8-26aa-447d-add5-444ddf2fefb5",
                "laravel_correlation_id": "e92f6750-9e00-4bff-a95f-34c3d4c29f50",
                "occurred_at": "2026-08-02T19:04:52.1865893Z",
                "replay_uuid": "58ea13b9-f911-471e-964f-cc075afbf6ca",
                "request_id": "26519a39-252e-4ef9-8730-e5883627f898",
                "stage": "GO_HTTP",
                "translator_trace_id": "7f5e7e63-ec5a-44ca-8905-89699626f100"
            }
        ],
        "execution_uuid": "70a0934e-84e0-4dac-bf51-26a0dc4125c2",
        "generated_grl": "\nrule TPR_de2a491d70d40698_0 \"TPR-IR 1.0\" salience 100 {\nwhen\n\t(employee.Status == \"aktif\")\nthen\n\tout.Emit(\"ADD_COMPONENT\", \"BONUS\", rates.Value(\"bonus_rate\"), 100, \"rule-version-3008\", 3008, 0);\n\tRetract(\"TPR_de2a491d70d40698_0\");\n}\n\nrule TPR_de2a4a1d70d4084b_0 \"TPR-IR 1.0\" salience 50 {\nwhen\n\t(attendance.LateMinutes > 0.0)\nthen\n\tout.Emit(\"ADD_COMPONENT\", \"LATE_DEDUCTION\", (attendance.LateMinutes * rates.Value(\"late_rate\")), 50, \"rule-version-3009\", 3009, 1);\n\tRetract(\"TPR_de2a4a1d70d4084b_0\");\n}\n",
        "generated_grl_sha256": "91994a2c9dc141cad2ac8bf3a005fa326a8a96cd68b787d5a996cbad349ae13a",
        "grule_execution_id": "dbe0f7e8-26aa-447d-add5-444ddf2fefb5",
        "laravel_correlation_id": "e92f6750-9e00-4bff-a95f-34c3d4c29f50",
        "matches_original_hash": true,
        "mode": "TEMPORAL_REPLAY",
        "output_sha256": "21310217a369a89dd5c411ee438866372d6fbd0072768cad19f23497c03306dc",
        "provenance": {
            "engine_version": "go-grule-tpr-engine-1.0",
            "execution_uuid": "70a0934e-84e0-4dac-bf51-26a0dc4125c2",
            "facts_sha256": "e8f3effc5fc3df2887c29dd7a080ad4bf22ecb47af13896a4d788e5f9ef7818b",
            "rate_version_ids": [
                1004
            ],
            "request_id": "91cef854-a1f5-4e99-a8bd-6847c95df686",
            "rule_version_ids": [
                3008,
                3009
            ],
            "ruleset_sha256": "2fd677bb37b38ea6cfd2f3f4271a157d2b8965e40d8e2ae4bc2eb12a19f764c2",
            "tax_version_ids": [
                2004
            ],
            "translator_version": "laravel-go-tpr-translator-1.0"
        },
        "replay_uuid": "58ea13b9-f911-471e-964f-cc075afbf6ca",
        "request_id": "26519a39-252e-4ef9-8730-e5883627f898",
        "rounding_trace": [
            {
                "component_code": "BONUS",
                "operation_timestamp": "2026-08-02T19:04:52.1865893Z",
                "raw_candidate_decimal": "10400",
                "rounded_result": "10400.000000",
                "rounding_mode": "HALF_UP",
                "rounding_quantum": "0.000001",
                "scale_before_rounding": 0,
                "source_rule": "rule-version-3008"
            },
            {
                "component_code": "LATE_DEDUCTION",
                "operation_timestamp": "2026-08-02T19:04:52.1865893Z",
                "raw_candidate_decimal": "7560",
                "rounded_result": "7560.000000",
                "rounding_mode": "HALF_UP",
                "rounding_quantum": "0.000001",
                "scale_before_rounding": 0,
                "source_rule": "rule-version-3009"
            }
        ],
        "summary": {
            "basic_salary": "5804000.000000",
            "gross_salary": "5814400.000000",
            "net_salary": "5806840.000000",
            "total_deductions": "7560.000000"
        },
        "translator_trace_id": "7f5e7e63-ec5a-44ca-8905-89699626f100"
    }
}
