{
    "artifact_version": "2.0",
    "run_id": "temporal-v2-20260813T195025Z-9379cd45",
    "case_id": "TEMP-244",
    "generated_at": "2026-08-13T20:15:15.254449Z",
    "schema_ref": "temporal-artifact-schemas/side-effect-result.schema.json",
    "payload_sha256": "153f050d2df7c094fb920c187414d22bba0ac536030257d217474f105725ce64",
    "payload": {
        "result": "PASS",
        "salary_side_effect_count": 0,
        "salary_state_sha256_after": "ba4282d148fda9152105c3bc26e569cb2f1a12e887977dbe6b409467c52be2fc",
        "salary_state_sha256_before": "ba4282d148fda9152105c3bc26e569cb2f1a12e887977dbe6b409467c52be2fc"
    }
}
