{
    "artifact_version": "2.0",
    "run_id": "temporal-v2-20260811T085034Z-9e6b3f3c",
    "case_id": "TEMP-038",
    "generated_at": "2026-08-11T09:14:00.123230Z",
    "schema_ref": "temporal-artifact-schemas/artifact-hashes.schema.json",
    "payload_sha256": "807137c64260c40ca60a3663338c06b1fda79d3d4338802985ca29ce8f236de9",
    "payload": {
        "artifacts": {
            "attempts/repeat-1/comparator-result.json": "e2153632039555a2cac005474c7f4ed35f565c32bc3d39ec43ac3b5be59e8e03",
            "attempts/repeat-1/correlation-events.jsonl": "5dab6029d08502d56506a382918baffc77d93568a8883c1ed5a49296387ce73d",
            "attempts/repeat-1/forbidden-query-trace.json": "738bf45a9c1c81bc3ef7e5874e95671930adb927d560ecb9f50c53cb61912122",
            "attempts/repeat-1/replay-request.json": "8120f8e116bb5279beedd8081e702c9dbd91c20af8201d7194fad57c38d102c4",
            "attempts/repeat-1/replay-response.json": "034dff0e59a14a4aff5ca3e2c4135075caae7e6e79cf6f4f6c39232ab93f1d94",
            "attempts/repeat-1/side-effect-check.json": "b89fe9527092eacf8ef5e48fb387b35930c43382b0ea7e1e57d48ba6f772093f",
            "attempts/repeat-1/version-applicability.json": "fb34fd96c5a967e6d6d1c67b37e687146986db6690f54b7234ead24d43c8a737",
            "attempts/repeat-2/comparator-result.json": "1deb73cb017abb608ee0cd063171adcbc9027cda178869def67885efd09ad801",
            "attempts/repeat-2/correlation-events.jsonl": "033d707c2ea638a00d403156aa445a153b31eb5900c7e6e32a9bd722b408f295",
            "attempts/repeat-2/forbidden-query-trace.json": "3b48e3ad8bd276d132b76c84bbebb7210bfd4cea2d7a777ab4cbff8709d49ec7",
            "attempts/repeat-2/replay-request.json": "c2e2afbefea34c957765ebcfe64a91e05e9cb61904f6a45005eafb09f31ea3b1",
            "attempts/repeat-2/replay-response.json": "02e9e27c5e33079e01c88eae0b647ed7097b30a79bd77157dbc7b21868211d17",
            "attempts/repeat-2/side-effect-check.json": "6b4b8cb355356347adec8cec8e93346fa625f7ea5473290eec37b51c1137bad7",
            "attempts/repeat-2/version-applicability.json": "ef433076f4fdf8afdf659b48b41a419ba668a1efc2b9d84dba3559094f0a89e6",
            "comparator-result.json": "3b98d8db38c4364f0ba42045ec2134901ca27ac77d896bfb4cb96e740bf4c730",
            "correlation-events.jsonl": "a6b5485827d8bfe25b6236c02212a6b4aa9b5aa5cc54285d9c8d275558878c73",
            "forbidden-query-trace.json": "660349664d4076d17bf5b51c161d9716edf7ef86511054abe04c0f1079b0be43",
            "manifest.json": "98e017154f6e14c6512f45ea530c0346f2e80b78097e0781a76577be04043cc7",
            "original-output.json": "e6bfd2252832126abe09635db922bc8270574f1b871d98fb5653533fd7aec721",
            "replay-request.json": "032defe00a53bfc354d4c088c56962029ccab25b148171ec663250698117010d",
            "replay-response.json": "8e7c307d9ce7a486528fe1ddf51c65ec7ee9e07bc02f0029a7119929ec90d42c",
            "side-effect-check.json": "474830d38e1da1e0adccc2a26c33f6bd7dc4e24bff95402e92644c5788d9b7c8",
            "version-applicability.json": "aa0a8faacc8955433fa37603eb2eb03e9331f2ecd72a08e7a734bcd1b9b22473"
        }
    }
}
